{
  "schemaVersion": 2,
  "id": "clipboard-bar",
  "name": "Clipboard Bar Button",
  "version": "2.0.0",
  "kind": "shared",
  "contributes": {
    "widgets": [
      {
        "id": "clipboardBar",
        "name": "Clipboard",
        "slot": "right",
        "component": "ClipboardButton.qml",
        "order": 30,
        "alwaysShow": true,
        "moduleId": "clipboard-bar"
      }
    ]
  }
}
