{
  "schemaVersion": 2,
  "id": "workspaces",
  "name": "Workspace Switcher",
  "version": "2.0.0",
  "kind": "shared",
  "contributes": {
    "widgets": [
      {
        "id": "workspaces",
        "name": "Workspace Switcher",
        "slot": "left",
        "component": "Workspaces.qml",
        "order": -10,
        "alwaysShow": true,
        "moduleId": "workspaces"
      }
    ]
  }
}
