{
  "schemaVersion": 2,
  "id": "app-launcher",
  "name": "App Launcher",
  "version": "2.0.0",
  "kind": "shared",
  "contributes": {
    "widgets": [
      {
        "id": "appLauncher",
        "name": "App Launcher",
        "slot": "left",
        "component": "AppLauncherButton.qml",
        "order": 0,
        "alwaysShow": true,
        "moduleId": "app-launcher"
      }
    ]
  }
}
